{
    "about_hero_url": "assets/img/gallery/about.png",
    "about_section_title": "ABOUT OUR GYM",
    "about_hero_caption": "Safe Body building proper Solutions That Saves our Valuable Time!",
    "about_description_primary": "Brook presents your services with flexible, convenient and cdpose layouts. You can select your favorite layouts & elements for cular ts with unlimited ustomization possibilities. Pixel-perfect replication of the designers is intended.",
    "about_description_secondary": "Brook presents your services with flexible, convefnient and chient anipurpose layouts. You can select your favorite layouts."
}